{
  "$schema": "https://json-schema.org/draft/2020-12/schema",
  "$id": "https://data.jinteki.win/schemas/trends.schema.json",
  "title": "Market Research slice trends (mr.trends/1)",
  "description": "Monthly additive counts. Each row is [month_index, restriction_index, ...columns]. Sum rows over any months, ban lists or tier groups, then divide sums.",
  "type": "object",
  "required": [
    "schema",
    "version",
    "side",
    "restriction",
    "tier_group",
    "months",
    "restrictions",
    "columns",
    "baseline_columns",
    "baseline",
    "factions",
    "faction_baseline",
    "cards"
  ],
  "additionalProperties": false,
  "properties": {
    "schema": {
      "description": "Schema ID and major version of this file.",
      "const": "mr.trends/1"
    },
    "version": {
      "description": "Snapshot version this file belongs to: the UTC start time of the pipeline run that published it, as YYYY-MM-DDTHHMMSSZ. Same as the v=<version>/ folder the file is in and the manifest's version.",
      "type": "string",
      "pattern": "^\\d{4}-\\d{2}-\\d{2}T\\d{6}Z$"
    },
    "side": {
      "description": "Side this slice covers: corp or runner.",
      "enum": [
        "corp",
        "runner"
      ]
    },
    "restriction": {
      "description": "Ban list of this slice: a NetrunnerDB Standard restriction ID (e.g. standard_ban_list_26_05), or all for every ban list combined.",
      "type": "string",
      "pattern": "^(all|[a-z0-9_]{1,80})$"
    },
    "tier_group": {
      "description": "Tier group of this slice (an id from the manifest's tier_groups, e.g. gnk, store, megacity, online), or all for every tier combined.",
      "type": "string",
      "pattern": "^(all|[a-z0-9_]{1,40})$"
    },
    "months": {
      "description": "Every month of the snapshot (the manifest's months). The first number of each row indexes this list.",
      "type": "array",
      "items": {
        "type": "string",
        "pattern": "^\\d{4}-\\d{2}$"
      }
    },
    "restrictions": {
      "description": "Ban lists of the snapshot, oldest first (without all). The second number of each row indexes this list.",
      "type": "array",
      "items": {
        "type": "string",
        "pattern": "^[a-z0-9_]{1,80}$"
      }
    },
    "columns": {
      "description": "Names of the numbers in each card row after [month_index, restriction_index]: decks with the card, copies summed over them, decks with 1 / 2 / 3+ copies, games and wins (a draw is half a win) of those decks, entries with the card in high-coverage tournaments and how many made the cut, high-coverage tournaments where the card was played, and decks with the card whose identity has the card's faction (decks_in_faction; the rest of decks_with_card play it out of faction).",
      "const": [
        "decks_with_card",
        "copies_sum",
        "qty1",
        "qty2",
        "qty3",
        "games_total",
        "games_won",
        "entries_with_card_hc",
        "cut_with_card_hc",
        "tournaments_hc_with_card",
        "decks_in_faction"
      ]
    },
    "baseline_columns": {
      "description": "Names of the numbers in each baseline row after [month_index, restriction_index]: the side's decks, games and wins where its deck is known, high-coverage entries and how many made the cut, tournaments, high-coverage tournaments, and every game and win of the side (deck known or not).",
      "const": [
        "side_decks",
        "side_games",
        "side_wins",
        "side_entries_hc",
        "side_cut_hc",
        "tournaments",
        "tournaments_hc",
        "side_games_all",
        "side_wins_all"
      ]
    },
    "baseline": {
      "description": "Side totals per month and ban list: rows of [month_index, restriction_index, ...baseline_columns]. Only month and ban list pairs with data have a row. In cut/trends.json, over top-cut decks only.",
      "type": "array",
      "items": {
        "type": "array",
        "items": {
          "type": "number",
          "minimum": 0
        },
        "minItems": 11,
        "maxItems": 11
      }
    },
    "factions": {
      "description": "Identity factions (NetrunnerDB faction IDs, e.g. jinteki, neutral_corp) of the snapshot's decks, the same list in every trends file. The third number of each faction_baseline row indexes this list.",
      "type": "array",
      "items": {
        "type": "string",
        "pattern": "^[a-z0-9_]{1,80}$"
      }
    },
    "faction_baseline": {
      "description": "The side's decks per month, ban list and identity faction: rows of [month_index, restriction_index, faction_index, decks]. Only triples with decks have a row; per month and ban list they add up to side_decks. The denominators of in-faction popularity (decks of the card's faction) and out-of-faction popularity (side_decks minus those). In cut/trends.json, over top-cut decks only.",
      "type": "array",
      "items": {
        "type": "array",
        "items": {
          "type": "integer",
          "minimum": 0
        },
        "minItems": 4,
        "maxItems": 4
      }
    },
    "cards": {
      "description": "Per card ID, rows of [month_index, restriction_index, ...columns], one per month and ban list in which the card was played. All numbers are additive: sum rows over any months, ban lists or tier groups, then divide the sums (e.g. popularity = sum of decks_with_card / sum of side_decks).",
      "type": "object",
      "propertyNames": {
        "type": "string",
        "pattern": "^[a-z0-9_]{1,80}$"
      },
      "additionalProperties": {
        "type": "array",
        "items": {
          "type": "array",
          "items": {
            "type": "number",
            "minimum": 0
          },
          "minItems": 13,
          "maxItems": 13
        }
      }
    }
  }
}
