{"schema":"mr.trends/1","version":"2026-09-27T040000Z","side":"runner","restriction":"standard_ban_list_26_05","tier_group":"megacity","months":["2026-06","2026-07","2026-08","2026-09"],"restrictions":["standard_ban_list_26_05","standard_balance_update_26_08"],"columns":["decks_with_card","copies_sum","qty1","qty2","qty3","games_total","games_won","entries_with_card_hc","cut_with_card_hc","tournaments_hc_with_card","decks_in_faction"],"baseline_columns":["side_decks","side_games","side_wins","side_entries_hc","side_cut_hc","tournaments","tournaments_hc","side_games_all","side_wins_all"],"baseline":[[0,0,6,0,0,6,6,1,1,0,0]],"factions":["anarch","criminal","haas_bioroid","jinteki","nbn","shaper","weyland_consortium"],"faction_baseline":[[0,0,0,2],[0,0,1,2],[0,0,5,2]],"cards":{"aircheck":[[0,0,1,3,0,0,1,0,0,1,1,1,1]],"backstitching":[[0,0,1,3,0,0,1,0,0,1,1,1,1]],"baker":[[0,0,1,3,0,0,1,0,0,1,1,1,1]],"banner":[[0,0,1,3,0,0,1,0,0,1,1,1,1]],"begemot":[[0,0,2,6,0,0,2,0,0,2,2,1,2]],"borrowed_goods":[[0,0,1,3,0,0,1,0,0,1,1,1,1]],"botulus":[[0,0,1,3,0,0,1,0,0,1,1,1,1]],"buffer_drive":[[0,0,1,3,0,0,1,0,0,1,1,1,0]],"carmen":[[0,0,1,3,0,0,1,0,0,1,1,1,1]],"carpe_diem":[[0,0,1,3,0,0,1,0,0,1,1,1,1]],"chain_reaction":[[0,0,1,3,0,0,1,0,0,1,1,1,1]],"chastushka":[[0,0,1,3,0,0,1,0,0,1,1,1,1]],"coalescence":[[0,0,1,3,0,0,1,0,0,1,1,1,1]],"cookbook":[[0,0,1,3,0,0,1,0,0,1,1,1,1]],"cordyceps":[[0,0,1,3,0,0,1,0,0,1,1,1,1]],"corsair":[[0,0,1,3,0,0,1,0,0,1,1,1,1]],"cybertrooper_talut":[[0,0,1,1,1,0,0,0,0,1,1,1,1]],"daily_casts":[[0,0,2,6,0,0,2,0,0,2,2,1,0]],"deep_dive":[[0,0,1,3,0,0,1,0,0,1,1,1,1]],"docklands_pass":[[0,0,2,6,0,0,2,0,0,2,2,1,1]],"dreamnet":[[0,0,1,3,0,0,1,0,0,1,1,1,0]],"eye_for_an_eye":[[0,0,1,3,0,0,1,0,0,1,1,1,1]],"fencer_fueno":[[0,0,1,3,0,0,1,0,0,1,1,1,1]],"friend_of_a_friend":[[0,0,1,3,0,0,1,0,0,1,1,1,1]],"gachapon":[[0,0,1,1,1,0,0,0,0,1,1,1,1]],"ghosttongue":[[0,0,1,3,0,0,1,0,0,1,1,1,1]],"hackerspace":[[0,0,1,1,1,0,0,0,0,1,1,1,1]],"hantu":[[0,0,1,3,0,0,1,0,0,1,1,1,1]],"heliamphora":[[0,0,2,6,0,0,2,0,0,2,2,1,2]],"illumination":[[0,0,1,3,0,0,1,0,0,1,1,1,1]],"in_the_groove":[[0,0,2,6,0,0,2,0,0,2,2,1,2]],"info_bounty":[[0,0,1,3,0,0,1,0,0,1,1,1,1]],"into_the_depths":[[0,0,1,3,0,0,1,0,0,1,1,1,1]],"jailbreak":[[0,0,2,6,0,0,2,0,0,2,2,1,0]],"katorga_breakout":[[0,0,1,3,0,0,1,0,0,1,1,1,1]],"lampades":[[0,0,1,3,0,0,1,0,0,1,1,1,1]],"leech":[[0,0,1,3,0,0,1,0,0,1,1,1,1]],"light_the_fire":[[0,0,1,3,0,0,1,0,0,1,1,1,1]],"lucky_charm":[[0,0,1,3,0,0,1,0,0,1,1,1,1]],"makler":[[0,0,1,3,0,0,1,0,0,1,1,1,1]],"malandragem":[[0,0,1,3,0,0,1,0,0,1,1,1,1]],"mayfly":[[0,0,1,3,0,0,1,0,0,1,1,1,0]],"methuselah":[[0,0,1,1,1,0,0,0,0,1,1,1,1]],"mu_safecracker":[[0,0,2,4,1,0,1,0,0,2,2,1,2]],"nga":[[0,0,1,1,1,0,0,0,0,1,1,1,1]],"nurse_hanh":[[0,0,1,1,1,0,0,0,0,1,1,1,1]],"open_market":[[0,0,1,3,0,0,1,0,0,1,1,1,1]],"overclock":[[0,0,2,6,0,0,2,0,0,2,2,1,0]],"pan_weave":[[0,0,1,3,0,0,1,0,0,1,1,1,1]],"paules_cafe":[[0,0,2,2,2,0,0,0,0,2,2,1,2]],"penrose":[[0,0,1,3,0,0,1,0,0,1,1,1,1]],"pichacao":[[0,0,1,3,0,0,1,0,0,1,1,1,1]],"pretty_mary_da_silva":[[0,0,2,4,1,0,1,0,0,2,2,1,2]],"read_write_share":[[0,0,2,6,0,0,2,0,0,2,2,1,2]],"rejig":[[0,0,1,3,0,0,1,0,0,1,1,1,0]],"reprise":[[0,0,1,3,0,0,1,0,0,1,1,1,1]],"rising_tide":[[0,0,1,3,0,0,1,0,0,1,1,1,1]],"rotary":[[0,0,1,1,1,0,0,0,0,1,1,1,1]],"s_dobrado":[[0,0,1,3,0,0,1,0,0,1,1,1,0]],"smartware_distributor":[[0,0,1,3,0,0,1,0,0,1,1,1,0]],"solidarity_badge":[[0,0,1,1,1,0,0,0,0,1,1,1,1]],"spec_work":[[0,0,1,3,0,0,1,0,0,1,1,1,1]],"stick_and_poke":[[0,0,1,1,1,0,0,0,0,1,1,1,1]],"stoneship_chart_room":[[0,0,2,6,0,0,2,0,0,2,2,1,2]],"sure_gamble":[[0,0,5,15,0,0,5,0,0,5,5,1,0]],"t400_memory_diamond":[[0,0,1,3,0,0,1,0,0,1,1,1,0]],"tailgate":[[0,0,1,3,0,0,1,0,0,1,1,1,1]],"telework_contract":[[0,0,2,6,0,0,2,0,0,2,2,1,2]],"the_artist":[[0,0,1,1,1,0,0,0,0,1,1,1,1]],"the_back":[[0,0,1,1,1,0,0,0,0,1,1,1,1]],"umbrella":[[0,0,1,1,1,0,0,0,0,1,1,1,1]],"underdome_irregulars":[[0,0,1,3,0,0,1,0,0,1,1,1,1]],"urban_art_vernissage":[[0,0,1,3,0,0,1,0,0,1,1,1,1]],"valentina_ferreira_carvalho":[[0,0,1,3,0,0,1,0,0,1,1,1,0]],"verbal_plasticity":[[0,0,1,1,1,0,0,0,0,1,1,1,0]],"virtuoso":[[0,0,1,3,0,0,1,0,0,1,1,1,1]],"vrcation":[[0,0,1,3,0,0,1,0,0,1,1,1,1]],"whistleblower":[[0,0,2,6,0,0,2,0,0,2,2,1,0]],"window_of_opportunity":[[0,0,1,3,0,0,1,0,0,1,1,1,1]],"zenit_chip_jz_2mj":[[0,0,1,3,0,0,1,0,0,1,1,1,1]]}}