{"schema":"mr.trends/1","version":"2026-09-27T040000Z","side":"corp","restriction":"standard_balance_update_26_08","tier_group":"megacity","months":["2026-06","2026-07","2026-08","2026-09"],"restrictions":["standard_ban_list_26_05","standard_balance_update_26_08"],"columns":["decks_with_card","copies_sum","qty1","qty2","qty3","games_total","games_won","entries_with_card_hc","cut_with_card_hc","tournaments_hc_with_card","decks_in_faction"],"baseline_columns":["side_decks","side_games","side_wins","side_entries_hc","side_cut_hc","tournaments","tournaments_hc","side_games_all","side_wins_all"],"baseline":[[3,1,16,53,29,16,4,1,1,53,29]],"factions":["anarch","criminal","haas_bioroid","jinteki","nbn","shaper","weyland_consortium"],"faction_baseline":[[3,1,2,4],[3,1,3,4],[3,1,4,4],[3,1,6,4]],"cards":{"ablative_barrier":[[3,1,1,3,0,0,1,4,3,1,1,1,1]],"above_the_law":[[3,1,1,1,1,0,0,1,0,1,0,1,1]],"aggressive_trendsetting":[[3,1,2,6,0,0,2,8,5,2,1,1,2]],"anemone":[[3,1,2,6,0,0,2,6,5,2,0,1,2]],"angelique_garza_correa":[[3,1,1,1,1,0,0,1,0,1,0,1,1]],"anvil":[[3,1,1,3,0,0,1,4,1.5,1,0,1,1]],"architect_deployment_test":[[3,1,1,1,1,0,0,4,3,1,1,1,1]],"argus_crackdown":[[3,1,1,3,0,0,1,4,1.5,1,0,1,1]],"armed_asset_protection":[[3,1,1,1,1,0,0,1,0,1,0,1,1]],"artificial_cryptocrash":[[3,1,1,3,0,0,1,5,3,1,0,1,1]],"attini":[[3,1,1,3,0,0,1,3,1,1,1,1,1]],"azef_protocol":[[3,1,1,3,0,0,1,5,1,1,0,1,1]],"b_1001":[[3,1,3,7,1,0,2,13,8.5,3,2,1,0]],"balanced_coverage":[[3,1,1,3,0,0,1,5,3,1,0,1,1]],"ballista":[[3,1,3,9,0,0,3,9,1,3,0,1,3]],"bass_ch1r180g4":[[3,1,2,2,2,0,0,5,4,2,1,1,2]],"biawak":[[3,1,1,3,0,0,1,4,1.5,1,0,1,1]],"big_deal":[[3,1,1,3,0,0,1,1,1,1,0,1,1]],"bigger_picture":[[3,1,1,3,0,0,1,1,1,1,0,1,1]],"bladderwort":[[3,1,1,3,0,0,1,3,1,1,1,1,1]],"blood_in_the_water":[[3,1,1,2,0,1,0,3,1,1,1,1,1]],"bloop":[[3,1,1,3,0,0,1,4,2,1,0,1,1]],"bran_1_0":[[3,1,1,1,1,0,0,1,1,1,0,1,1]],"bring_them_home":[[3,1,1,3,0,0,1,3,1,1,1,1,1]],"bumi_1_0":[[3,1,1,3,0,0,1,2,1,1,0,1,1]],"business_as_usual":[[3,1,1,3,0,0,1,4,1.5,1,0,1,1]],"calvin_b4l3y":[[3,1,1,3,0,0,1,2,1,1,0,1,1]],"capacitor":[[3,1,1,3,0,0,1,5,3,1,0,1,1]],"caveat_emptor":[[3,1,1,3,0,0,1,4,2,1,0,1,1]],"charlotte_cacador":[[3,1,1,3,0,0,1,8,5.5,1,1,1,1]],"chekist_scion":[[3,1,1,3,0,0,1,1,1,1,0,1,1]],"clearinghouse":[[3,1,1,3,0,0,1,4,1.5,1,0,1,1]],"cloud_eater":[[3,1,1,1,1,0,0,3,2,1,0,1,1]],"cohort_guidance_program":[[3,1,4,12,0,0,4,17,11.5,4,2,1,4]],"complete_image":[[3,1,1,3,0,0,1,8,5.5,1,1,1,1]],"congratulations":[[3,1,1,3,0,0,1,2,1,1,1,1,1]],"csr_campaign":[[3,1,2,6,0,0,2,6,1,2,0,1,0]],"daily_quest":[[3,1,2,6,0,0,2,6,4,2,1,1,2]],"descent":[[3,1,1,3,0,0,1,5,1,1,0,1,1]],"digital_rights_management":[[3,1,1,3,0,0,1,4,3,1,1,1,0]],"echo":[[3,1,1,3,0,0,1,2,1,1,0,1,1]],"embedded_reporting":[[3,1,1,3,0,0,1,2,1,1,1,1,1]],"eminent_domain":[[3,1,1,3,0,0,1,1,0,1,0,1,1]],"empiricist":[[3,1,1,1,1,0,0,3,3,1,0,1,1]],"end_of_the_line":[[3,1,1,3,0,0,1,5,1,1,0,1,1]],"event_horizon":[[3,1,1,3,0,0,1,5,1,1,0,1,1]],"ezam":[[3,1,1,3,0,0,1,3,1,1,1,1,1]],"f2p":[[3,1,1,3,0,0,1,1,1,1,0,1,1]],"federal_fundraising":[[3,1,2,4,1,0,1,5,4,2,0,1,2]],"flower_sermon":[[3,1,2,6,0,0,2,6,5,2,0,1,2]],"flyswatter":[[3,1,1,3,0,0,1,3,2,1,0,1,0]],"focus_group":[[3,1,1,3,0,0,1,5,3,1,0,1,1]],"freedom_of_information":[[3,1,1,3,0,0,1,5,3,1,0,1,1]],"front_company":[[3,1,1,3,0,0,1,8,5.5,1,1,1,1]],"fujii_asset_retrieval":[[3,1,1,2,0,1,0,8,5.5,1,1,1,1]],"fully_operational":[[3,1,1,3,0,0,1,4,3,1,1,1,1]],"gaslight":[[3,1,1,3,0,0,1,4,3,1,0,1,1]],"hagen":[[3,1,1,1,1,0,0,4,3,1,1,1,1]],"hakarl_1_0":[[3,1,1,3,0,0,1,2,1,1,0,1,1]],"hammer":[[3,1,1,3,0,0,1,3,0,1,0,1,1]],"hansei_review":[[3,1,1,3,0,0,1,3,3,1,0,1,1]],"hearts_and_minds":[[3,1,1,3,0,0,1,1,0,1,0,1,1]],"hedge_fund":[[3,1,16,48,0,0,16,53,29,16,4,1,0]],"hostile_architecture":[[3,1,1,2,0,1,0,3,0,1,0,1,1]],"humanoid_resources":[[3,1,2,6,0,0,2,5,3,2,0,1,2]],"hyoubu_precog_manifold":[[3,1,1,3,0,0,1,3,1,1,1,1,1]],"hypoxia":[[3,1,1,3,0,0,1,2,1,1,0,1,1]],"idiosyncresis":[[3,1,1,3,0,0,1,5,3,1,0,1,1]],"increased_drop_rates":[[3,1,2,6,0,0,2,6,4,2,1,1,2]],"ip_enforcement":[[3,1,3,9,0,0,3,10,7,3,0,1,3]],"isaac_liberdade":[[3,1,1,3,0,0,1,3,2,1,0,1,0]],"ivik":[[3,1,1,3,0,0,1,8,5.5,1,1,1,1]],"jaguarundi":[[3,1,1,3,0,0,1,3,3,1,0,1,0]],"janaina_jk_dumont_kindelan":[[3,1,2,2,2,0,0,5,4,2,0,1,2]],"karuna":[[3,1,1,1,1,0,0,8,5.5,1,1,1,1]],"kessleroid":[[3,1,1,3,0,0,1,3,0,1,0,1,1]],"key_performance_indicators":[[3,1,1,3,0,0,1,3,0,1,0,1,1]],"knowledge_seeker":[[3,1,1,3,0,0,1,8,5.5,1,1,1,1]],"la_costa_grid":[[3,1,1,3,0,0,1,3,3,1,0,1,1]],"lamplighter":[[3,1,1,3,0,0,1,2,1,1,0,1,0]],"let_them_dream":[[3,1,7,19,0,2,5,20,11.5,7,1,1,0]],"lethe":[[3,1,1,3,0,0,1,2,1,1,1,1,1]],"letheia_nisei":[[3,1,1,1,1,0,0,3,2,1,0,1,1]],"lightning_laboratory":[[3,1,2,6,0,0,2,5,4,2,1,1,2]],"longevity_serum":[[3,1,2,2,2,0,0,6,4,2,1,1,2]],"lotus_haze":[[3,1,1,3,0,0,1,3,1,1,1,1,1]],"luana_campos":[[3,1,1,1,1,0,0,5,1,1,0,1,1]],"lycian_multi_munition":[[3,1,1,3,0,0,1,1,1,1,0,1,1]],"m_i_c":[[3,1,1,3,0,0,1,4,3,1,1,1,1]],"mahkota_langit_grid":[[3,1,1,3,0,0,1,1,1,1,0,1,0]],"maskirovka":[[3,1,1,3,0,0,1,3,0,1,0,1,1]],"mavirus":[[3,1,1,3,0,0,1,3,2,1,0,1,1]],"measured_response":[[3,1,1,3,0,0,1,4,1.5,1,0,1,1]],"megaprix_qualifier":[[3,1,3,9,0,0,3,7,5,3,1,1,3]],"mercia_b4ll4rd":[[3,1,2,4,1,0,1,6,4,2,1,1,2]],"mestnichestvo":[[3,1,2,6,0,0,2,7,4,2,1,1,2]],"mitosis":[[3,1,1,3,0,0,1,3,2,1,0,1,1]],"mutually_assured_destruction":[[3,1,2,6,0,0,2,6,1,2,0,1,2]],"myoshu":[[3,1,1,3,0,0,1,1,0,1,0,1,1]],"n_pot":[[3,1,1,3,0,0,1,4,3,1,0,1,1]],"napd_cordon":[[3,1,3,9,0,0,3,9,4,3,2,1,0]],"neurospike":[[3,1,1,3,0,0,1,3,3,1,0,1,1]],"nihilo_agent":[[3,1,1,3,0,0,1,5,3,1,0,1,1]],"off_the_books":[[3,1,1,3,0,0,1,5,1,1,0,1,1]],"ontological_dependence":[[3,1,1,2,0,1,0,1,1,1,0,1,1]],"oracle_thinktank":[[3,1,2,6,0,0,2,5,4,2,0,1,2]],"orbital_superiority":[[3,1,2,6,0,0,2,8,4.5,2,1,1,0]],"otto_campaign":[[3,1,2,6,0,0,2,5,4,2,1,1,2]],"palisade":[[3,1,2,6,0,0,2,9,6,2,0,1,0]],"paywall":[[3,1,1,3,0,0,1,4,3,1,0,1,1]],"peer_review":[[3,1,1,3,0,0,1,3,3,1,0,1,1]],"petty_cash":[[3,1,3,7,1,0,2,8,4,3,0,1,0]],"phoneutria":[[3,1,1,3,0,0,1,3,2,1,0,1,1]],"ping":[[3,1,1,2,0,1,0,2,1,1,1,1,1]],"piranhas":[[3,1,2,6,0,0,2,3,2,2,1,1,2]],"post_truth_dividend":[[3,1,1,3,0,0,1,4,3,1,0,1,1]],"project_ingatan":[[3,1,2,6,0,0,2,6,3,2,0,1,2]],"proprionegation":[[3,1,1,3,0,0,1,8,5.5,1,1,1,1]],"pulse":[[3,1,1,3,0,0,1,4,2,1,0,1,1]],"reanimation_protocol":[[3,1,1,3,0,0,1,3,0,1,0,1,1]],"reaper_function":[[3,1,2,6,0,0,2,6,3,2,1,1,2]],"refuge_campaign":[[3,1,1,3,0,0,1,2,1,1,0,1,1]],"regolith_mining_license":[[3,1,8,24,0,0,8,27,11,8,2,1,0]],"remastered_edition":[[3,1,1,3,0,0,1,1,1,1,0,1,1]],"rime":[[3,1,2,6,0,0,2,7,2.5,2,1,1,0]],"roughneck_repair_squad":[[3,1,1,3,0,0,1,1,0,1,0,1,1]],"sacrifice_zone_expansion":[[3,1,1,3,0,0,1,3,0,1,0,1,1]],"sandstone":[[3,1,1,3,0,0,1,4,1.5,1,0,1,1]],"scatter_field":[[3,1,2,6,0,0,2,5,3,2,0,1,2]],"sds_drone_deployment":[[3,1,1,3,0,0,1,4,1.5,1,0,1,1]],"secure_and_protect":[[3,1,1,3,0,0,1,4,1.5,1,0,1,1]],"send_a_message":[[3,1,4,12,0,0,4,14,6,4,0,1,0]],"sericulture_expansion":[[3,1,1,3,0,0,1,3,3,1,0,1,1]],"shackleton_grid":[[3,1,2,6,0,0,2,5,2,2,0,1,1]],"shipment_from_vladisibirsk":[[3,1,2,6,0,0,2,9,6,2,0,1,2]],"simulation_reset":[[3,1,1,3,0,0,1,3,3,1,0,1,1]],"sisyphus_protocol":[[3,1,2,6,0,0,2,6,3,2,1,1,2]],"slash_and_burn_agriculture":[[3,1,2,6,0,0,2,6,1,2,0,1,2]],"spin_doctor":[[3,1,1,1,1,0,0,1,1,1,0,1,1]],"sprint":[[3,1,1,3,0,0,1,4,3,1,1,1,1]],"stoke_the_embers":[[3,1,1,3,0,0,1,2,1,1,1,1,1]],"superconducting_hub":[[3,1,3,9,0,0,3,8,4,3,1,1,0]],"syailendra":[[3,1,1,3,0,0,1,5,1,1,0,1,1]],"sync_rerouting":[[3,1,3,9,0,0,3,8,5,3,1,1,3]],"synchrocyclotron":[[3,1,1,1,1,0,0,4,2,1,0,1,1]],"tatu_bola":[[3,1,1,3,0,0,1,3,1,1,1,1,1]],"the_basalt_spire":[[3,1,1,3,0,0,1,1,0,1,0,1,1]],"the_powers_that_be":[[3,1,2,6,0,0,2,12,7.5,2,1,1,0]],"the_red_room":[[3,1,1,3,0,0,1,3,3,1,0,1,1]],"tiered_subscription":[[3,1,1,3,0,0,1,1,1,1,0,1,1]],"tithe":[[3,1,4,12,0,0,4,17,11.5,4,2,1,0]],"tomorrows_headline":[[3,1,3,3,3,0,0,7,5,3,1,1,3]],"top_down_solutions":[[3,1,2,6,0,0,2,6,3,2,0,1,2]],"ubiquitous_vig":[[3,1,1,3,0,0,1,5,3,1,0,1,1]],"vampyronassa":[[3,1,1,3,0,0,1,8,5.5,1,1,1,1]],"vaporframe_fabricator":[[3,1,1,2,0,1,0,4,2,1,0,1,1]],"vladisibirsk_city_grid":[[3,1,1,3,0,0,1,1,1,1,0,1,1]],"vulnerability_audit":[[3,1,1,3,0,0,1,8,5.5,1,1,1,0]],"vulture_fund":[[3,1,2,6,0,0,2,9,2.5,2,0,1,2]],"whitespace":[[3,1,2,6,0,0,2,3,2,2,1,1,0]],"witch_hunt":[[3,1,2,6,0,0,2,5,4,2,0,1,2]],"zato_city_grid":[[3,1,1,3,0,0,1,3,0,1,0,1,1]]}}