{"schema":"mr.trends/1","version":"2026-09-27T040000Z","side":"runner","restriction":"all","tier_group":"store","months":["2026-06","2026-07","2026-08","2026-09"],"restrictions":["standard_ban_list_26_05","standard_balance_update_26_08"],"columns":["decks_with_card","copies_sum","qty1","qty2","qty3","games_total","games_won","entries_with_card_hc","cut_with_card_hc","tournaments_hc_with_card","decks_in_faction"],"baseline_columns":["side_decks","side_games","side_wins","side_entries_hc","side_cut_hc","tournaments","tournaments_hc","side_games_all","side_wins_all"],"baseline":[[1,0,3,0,0,3,3,1,1,0,0]],"factions":["anarch","criminal","haas_bioroid","jinteki","nbn","shaper","weyland_consortium"],"faction_baseline":[[1,0,1,2],[1,0,5,1]],"cards":{"always_have_a_backup_plan":[[1,0,1,3,0,0,1,0,0,1,1,1,1]],"amelia_earhart":[[1,0,1,1,1,0,0,0,0,1,1,1,1]],"backstitching":[[1,0,1,3,0,0,1,0,0,1,1,1,1]],"bahia_bands":[[1,0,2,6,0,0,2,0,0,2,2,1,0]],"borrowed_goods":[[1,0,1,3,0,0,1,0,0,1,1,1,1]],"chrysopoeian_skimming":[[1,0,1,3,0,0,1,0,0,1,1,1,1]],"clean_getaway":[[1,0,1,3,0,0,1,0,0,1,1,1,1]],"dreamnet":[[1,0,2,4,1,0,1,0,0,2,2,1,0]],"dzmz_optimizer":[[1,0,1,3,0,0,1,0,0,1,1,1,1]],"gamedragon_pro":[[1,0,1,3,0,0,1,0,0,1,1,1,1]],"gauss":[[1,0,1,3,0,0,1,0,0,1,1,1,1]],"laser_pointer":[[1,0,1,3,0,0,1,0,0,1,1,1,1]],"living_mural":[[1,0,1,3,0,0,1,0,0,1,1,1,1]],"lobisomem":[[1,0,1,3,0,0,1,0,0,1,1,1,1]],"lucky_charm":[[1,0,1,3,0,0,1,0,0,1,1,1,1]],"maintenance_access":[[1,0,1,3,0,0,1,0,0,1,1,1,1]],"malandragem":[[1,0,1,3,0,0,1,0,0,1,1,1,1]],"mayfly":[[1,0,1,3,0,0,1,0,0,1,1,1,0]],"meeting_of_minds":[[1,0,1,3,0,0,1,0,0,1,1,1,1]],"nanuq":[[1,0,1,3,0,0,1,0,0,1,1,1,1]],"no_free_lunch":[[1,0,1,3,0,0,1,0,0,1,1,1,1]],"open_market":[[1,0,1,3,0,0,1,0,0,1,1,1,1]],"overclock":[[1,0,1,3,0,0,1,0,0,1,1,1,0]],"poison_vial":[[1,0,1,3,0,0,1,0,0,1,1,1,1]],"rejig":[[1,0,1,3,0,0,1,0,0,1,1,1,0]],"reprise":[[1,0,1,3,0,0,1,0,0,1,1,1,1]],"revolver":[[1,0,1,3,0,0,1,0,0,1,1,1,1]],"s_dobrado":[[1,0,2,5,0,1,1,0,0,2,2,1,2]],"smartware_distributor":[[1,0,1,3,0,0,1,0,0,1,1,1,0]],"spark_of_inspiration":[[1,0,1,3,0,0,1,0,0,1,1,1,1]],"stowaway":[[1,0,1,3,0,0,1,0,0,1,1,1,1]],"sure_gamble":[[1,0,2,6,0,0,2,0,0,2,2,1,0]],"t400_memory_diamond":[[1,0,1,3,0,0,1,0,0,1,1,1,0]],"the_artist":[[1,0,1,1,1,0,0,0,0,1,1,1,1]],"the_back":[[1,0,1,3,0,0,1,0,0,1,1,1,1]],"tranquilizer":[[1,0,1,3,0,0,1,0,0,1,1,1,1]],"transfer_of_wealth":[[1,0,2,6,0,0,2,0,0,2,2,1,2]],"valentina_ferreira_carvalho":[[1,0,2,4,1,0,1,0,0,2,2,1,0]],"verbal_plasticity":[[1,0,1,1,1,0,0,0,0,1,1,1,0]],"wake_implant_v2a_jrj":[[1,0,1,1,1,0,0,0,0,1,1,1,1]],"whistleblower":[[1,0,2,2,2,0,0,0,0,2,2,1,0]],"word_on_the_street":[[1,0,1,1,1,0,0,0,0,1,1,1,0]],"zenit_chip_jz_2mj":[[1,0,1,2,0,1,0,0,0,1,1,1,1]]}}