{"schema":"mr.trends/1","version":"2026-09-27T040000Z","side":"runner","restriction":"standard_balance_update_26_08","tier_group":"megacity","months":["2026-06","2026-07","2026-08","2026-09"],"restrictions":["standard_ban_list_26_05","standard_balance_update_26_08"],"columns":["decks_with_card","copies_sum","qty1","qty2","qty3","games_total","games_won","entries_with_card_hc","cut_with_card_hc","tournaments_hc_with_card","decks_in_faction"],"baseline_columns":["side_decks","side_games","side_wins","side_entries_hc","side_cut_hc","tournaments","tournaments_hc","side_games_all","side_wins_all"],"baseline":[[3,1,4,18,12.5,4,4,1,1,18,12.5]],"factions":["anarch","criminal","haas_bioroid","jinteki","nbn","shaper","weyland_consortium"],"faction_baseline":[[3,1,1,2],[3,1,5,2]],"cards":{"amelia_earhart":[[3,1,1,1,1,0,0,1,1,1,1,1,1]],"backstitching":[[3,1,1,3,0,0,1,6,4.5,1,1,1,1]],"bahia_bands":[[3,1,2,6,0,0,2,7,4,2,2,1,0]],"carmen":[[3,1,1,3,0,0,1,6,4.5,1,1,1,1]],"clean_getaway":[[3,1,1,3,0,0,1,1,1,1,1,1,1]],"coalescence":[[3,1,1,3,0,0,1,5,4,1,1,1,1]],"cybertrooper_talut":[[3,1,1,1,1,0,0,5,4,1,1,1,1]],"docklands_pass":[[3,1,1,3,0,0,1,6,4.5,1,1,1,1]],"dreamnet":[[3,1,2,4,1,0,1,11,7,2,2,1,0]],"dzmz_optimizer":[[3,1,1,3,0,0,1,6,3,1,1,1,1]],"gamedragon_pro":[[3,1,1,3,0,0,1,6,3,1,1,1,1]],"gauss":[[3,1,1,3,0,0,1,6,3,1,1,1,1]],"in_the_groove":[[3,1,1,3,0,0,1,5,4,1,1,1,1]],"info_bounty":[[3,1,1,3,0,0,1,6,4.5,1,1,1,1]],"into_the_depths":[[3,1,1,3,0,0,1,5,4,1,1,1,1]],"jailbreak":[[3,1,1,3,0,0,1,5,4,1,1,1,0]],"knickknack_obrian":[[3,1,1,3,0,0,1,1,1,1,1,1,0]],"living_mural":[[3,1,1,3,0,0,1,6,3,1,1,1,1]],"lobisomem":[[3,1,1,3,0,0,1,6,3,1,1,1,1]],"maintenance_access":[[3,1,1,3,0,0,1,1,1,1,1,1,1]],"malandragem":[[3,1,2,6,0,0,2,7,5.5,2,2,1,2]],"mayfly":[[3,1,1,3,0,0,1,6,3,1,1,1,0]],"meeting_of_minds":[[3,1,1,3,0,0,1,1,1,1,1,1,1]],"methuselah":[[3,1,1,1,1,0,0,5,4,1,1,1,1]],"mu_safecracker":[[3,1,1,1,1,0,0,6,4.5,1,1,1,1]],"nanuq":[[3,1,1,3,0,0,1,6,3,1,1,1,1]],"no_free_lunch":[[3,1,1,3,0,0,1,1,1,1,1,1,1]],"overclock":[[3,1,1,3,0,0,1,5,4,1,1,1,0]],"pan_weave":[[3,1,1,3,0,0,1,6,4.5,1,1,1,1]],"paules_cafe":[[3,1,1,1,1,0,0,5,4,1,1,1,1]],"pichacao":[[3,1,1,3,0,0,1,5,4,1,1,1,1]],"poison_vial":[[3,1,1,3,0,0,1,1,1,1,1,1,1]],"pretty_mary_da_silva":[[3,1,1,1,1,0,0,5,4,1,1,1,1]],"read_write_share":[[3,1,1,3,0,0,1,5,4,1,1,1,1]],"rejig":[[3,1,2,6,0,0,2,7,5.5,2,2,1,0]],"reprise":[[3,1,1,3,0,0,1,6,4.5,1,1,1,1]],"revolver":[[3,1,1,3,0,0,1,1,1,1,1,1,1]],"s_dobrado":[[3,1,1,3,0,0,1,1,1,1,1,1,1]],"smartware_distributor":[[3,1,1,3,0,0,1,6,3,1,1,1,0]],"spark_of_inspiration":[[3,1,1,3,0,0,1,6,3,1,1,1,1]],"spec_work":[[3,1,1,3,0,0,1,5,4,1,1,1,1]],"stoneship_chart_room":[[3,1,1,3,0,0,1,5,4,1,1,1,1]],"stowaway":[[3,1,1,3,0,0,1,6,3,1,1,1,1]],"sure_gamble":[[3,1,4,12,0,0,4,18,12.5,4,4,1,0]],"t400_memory_diamond":[[3,1,2,6,0,0,2,12,7.5,2,2,1,0]],"telework_contract":[[3,1,1,3,0,0,1,5,4,1,1,1,1]],"the_artist":[[3,1,2,2,2,0,0,11,7,2,2,1,2]],"trickster_taka":[[3,1,1,3,0,0,1,6,4.5,1,1,1,0]],"umbrella":[[3,1,1,1,1,0,0,5,4,1,1,1,1]],"underdome_irregulars":[[3,1,1,3,0,0,1,6,4.5,1,1,1,1]],"urban_art_vernissage":[[3,1,1,3,0,0,1,5,4,1,1,1,1]],"valentina_ferreira_carvalho":[[3,1,2,6,0,0,2,12,7.5,2,2,1,0]],"verbal_plasticity":[[3,1,1,1,1,0,0,1,1,1,1,1,0]],"whistleblower":[[3,1,1,1,1,0,0,6,3,1,1,1,0]],"zenit_chip_jz_2mj":[[3,1,1,2,0,1,0,1,1,1,1,1,1]]}}