{"schema":"mr.trends/1","version":"2026-09-27T040000Z","side":"runner","restriction":"all","tier_group":"store","months":["2026-06","2026-07","2026-08","2026-09"],"restrictions":["standard_ban_list_26_05","standard_balance_update_26_08"],"columns":["decks_with_card","copies_sum","qty1","qty2","qty3","games_total","games_won","entries_with_card_hc","cut_with_card_hc","tournaments_hc_with_card","decks_in_faction"],"baseline_columns":["side_decks","side_games","side_wins","side_entries_hc","side_cut_hc","tournaments","tournaments_hc","side_games_all","side_wins_all"],"baseline":[[1,0,9,0,0,9,3,1,1,0,0],[3,1,3,8,7,0,0,1,0,22,11.5]],"factions":["anarch","criminal","haas_bioroid","jinteki","nbn","shaper","weyland_consortium"],"faction_baseline":[[1,0,0,2],[1,0,1,3],[1,0,5,4],[3,1,0,1],[3,1,1,1],[3,1,5,1]],"cards":{"abaasy":[[1,0,2,6,0,0,2,0,0,2,0,1,2],[3,1,1,3,0,0,1,3,3,0,0,0,1]],"always_have_a_backup_plan":[[1,0,1,3,0,0,1,0,0,1,1,1,1]],"amanuensis":[[1,0,1,3,0,0,1,0,0,1,0,1,1],[3,1,1,1,1,0,0,3,3,0,0,0,1]],"amelia_earhart":[[1,0,1,1,1,0,0,0,0,1,1,1,1],[3,1,1,1,1,0,0,3,3,0,0,0,1]],"aniccam":[[1,0,1,3,0,0,1,0,0,1,0,1,1]],"arruaceiras_crew":[[1,0,2,6,0,0,2,0,0,2,0,1,2]],"audrey_v2":[[1,0,1,3,0,0,1,0,0,1,0,1,1]],"backstitching":[[1,0,2,6,0,0,2,0,0,2,1,1,2]],"bahia_bands":[[1,0,3,9,0,0,3,0,0,3,2,1,0],[3,1,1,3,0,0,1,3,3,0,0,0,0]],"banner":[[3,1,1,3,0,0,1,3,3,0,0,0,1]],"basilar_synthgland_2kvj":[[1,0,1,3,0,0,1,0,0,1,0,1,1]],"begemot":[[3,1,1,3,0,0,1,3,3,0,0,0,1]],"boi_tata":[[1,0,1,3,0,0,1,0,0,1,0,1,1]],"borrowed_goods":[[1,0,1,3,0,0,1,0,0,1,1,1,1],[3,1,1,3,0,0,1,3,3,0,0,0,1]],"botulus":[[3,1,1,3,0,0,1,3,3,0,0,0,1]],"burner":[[1,0,1,3,0,0,1,0,0,1,0,1,1]],"buzzsaw":[[1,0,1,3,0,0,1,0,0,1,0,1,1]],"cacophony":[[1,0,2,4,1,0,1,0,0,2,0,1,2]],"carmen":[[1,0,1,3,0,0,1,0,0,1,0,1,1]],"carnivore":[[3,1,1,3,0,0,1,3,3,0,0,0,1]],"cataloguer":[[1,0,1,3,0,0,1,0,0,1,0,1,1]],"chain_reaction":[[1,0,1,3,0,0,1,0,0,1,0,1,1],[3,1,1,3,0,0,1,3,3,0,0,0,1]],"chrysopoeian_skimming":[[1,0,1,3,0,0,1,0,0,1,1,1,1]],"clean_getaway":[[1,0,1,3,0,0,1,0,0,1,1,1,1]],"climactic_showdown":[[3,1,1,1,1,0,0,3,3,0,0,0,1]],"coalescence":[[1,0,1,3,0,0,1,0,0,1,0,1,1],[3,1,1,3,0,0,1,2,1,0,0,0,1]],"conduit":[[1,0,1,3,0,0,1,0,0,1,0,1,1]],"cordyceps":[[1,0,1,3,0,0,1,0,0,1,0,1,1]],"cupellation":[[3,1,1,3,0,0,1,3,3,0,0,0,1]],"curupira":[[3,1,1,3,0,0,1,3,3,0,0,0,1]],"cybertrooper_talut":[[3,1,1,1,1,0,0,2,1,0,0,0,1]],"daeg_first_net_cat":[[1,0,1,3,0,0,1,0,0,1,0,1,1]],"demolisher":[[1,0,2,3,1,1,0,0,0,2,0,1,2]],"devil_charm":[[3,1,1,1,1,0,0,3,3,0,0,0,1]],"direct_access":[[1,0,1,3,0,0,1,0,0,1,0,1,0]],"docklands_pass":[[1,0,1,3,0,0,1,0,0,1,0,1,1]],"dreamnet":[[1,0,2,4,1,0,1,0,0,2,2,1,0],[3,1,1,3,0,0,1,2,1,0,0,0,0]],"dzmz_optimizer":[[1,0,1,3,0,0,1,0,0,1,1,1,1]],"echelon":[[1,0,2,6,0,0,2,0,0,2,0,1,2]],"environmental_testing":[[1,0,1,1,1,0,0,0,0,1,0,1,1]],"fencer_fueno":[[3,1,1,2,0,1,0,3,3,0,0,0,1]],"fermenter":[[3,1,1,3,0,0,1,3,3,0,0,0,1]],"finality":[[1,0,1,3,0,0,1,0,0,1,0,1,1],[3,1,1,3,0,0,1,3,3,0,0,0,1]],"flux_capacitor":[[1,0,2,4,1,0,1,0,0,2,0,1,2]],"gamedragon_pro":[[1,0,2,4,1,0,1,0,0,2,1,1,2]],"gauss":[[1,0,1,3,0,0,1,0,0,1,1,1,1]],"gourmand":[[1,0,1,3,0,0,1,0,0,1,0,1,1]],"hannah_wheels_pilintra":[[1,0,2,4,1,0,1,0,0,2,0,1,2]],"harmony_ar_therapy":[[1,0,1,3,0,0,1,0,0,1,0,1,1]],"hermes":[[3,1,1,3,0,0,1,3,3,0,0,0,1]],"hippocampic_mechanocytes":[[1,0,1,1,1,0,0,0,0,1,0,1,1]],"hush":[[1,0,1,3,0,0,1,0,0,1,0,1,1]],"hyperbaric":[[1,0,2,6,0,0,2,0,0,2,0,1,2]],"in_the_groove":[[3,1,1,3,0,0,1,2,1,0,0,0,1]],"info_bounty":[[1,0,1,3,0,0,1,0,0,1,0,1,1]],"into_the_depths":[[1,0,1,3,0,0,1,0,0,1,0,1,1],[3,1,1,3,0,0,1,2,1,0,0,0,1]],"isolation":[[1,0,1,3,0,0,1,0,0,1,0,1,1]],"jailbreak":[[3,1,2,6,0,0,2,5,4,0,0,0,0]],"jeitinho":[[3,1,1,1,1,0,0,3,3,0,0,0,1]],"joy_ride":[[1,0,1,3,0,0,1,0,0,1,0,1,1]],"keiko":[[3,1,1,3,0,0,1,3,3,0,0,0,1]],"laser_pointer":[[1,0,1,3,0,0,1,0,0,1,1,1,1]],"living_mural":[[1,0,1,3,0,0,1,0,0,1,1,1,1]],"lobisomem":[[1,0,1,3,0,0,1,0,0,1,1,1,1]],"lucky_charm":[[1,0,1,3,0,0,1,0,0,1,1,1,1],[3,1,1,1,1,0,0,3,3,0,0,0,1]],"madani":[[1,0,1,1,1,0,0,0,0,1,0,1,1]],"maintenance_access":[[1,0,1,3,0,0,1,0,0,1,1,1,1]],"malandragem":[[1,0,2,6,0,0,2,0,0,2,1,1,2]],"marrow":[[3,1,1,1,1,0,0,3,3,0,0,0,1]],"mayfly":[[1,0,2,6,0,0,2,0,0,2,1,1,0]],"meeting_of_minds":[[1,0,1,3,0,0,1,0,0,1,1,1,1]],"methuselah":[[1,0,1,1,1,0,0,0,0,1,0,1,1],[3,1,1,1,1,0,0,2,1,0,0,0,1]],"mu_safecracker":[[1,0,1,1,1,0,0,0,0,1,0,1,1]],"mystic_maemi":[[1,0,1,1,1,0,0,0,0,1,0,1,1]],"nanuq":[[1,0,1,3,0,0,1,0,0,1,1,1,1]],"no_free_lunch":[[1,0,1,3,0,0,1,0,0,1,1,1,1]],"num":[[1,0,2,6,0,0,2,0,0,2,0,1,2]],"odore":[[3,1,1,3,0,0,1,3,3,0,0,0,1]],"open_market":[[1,0,1,3,0,0,1,0,0,1,1,1,1],[3,1,1,3,0,0,1,3,3,0,0,0,1]],"overclock":[[1,0,1,3,0,0,1,0,0,1,1,1,0],[3,1,2,5,0,1,1,5,4,0,0,0,0]],"paladin_poemu":[[1,0,1,1,1,0,0,0,0,1,0,1,1]],"pan_weave":[[1,0,1,3,0,0,1,0,0,1,0,1,1],[3,1,1,1,1,0,0,3,3,0,0,0,1]],"pantograph":[[1,0,1,3,0,0,1,0,0,1,0,1,1]],"paules_cafe":[[3,1,1,1,1,0,0,2,1,0,0,0,1]],"pelangi":[[1,0,1,3,0,0,1,0,0,1,0,1,1]],"pennyshaver":[[3,1,1,3,0,0,1,3,3,0,0,0,1]],"pichacao":[[3,1,1,3,0,0,1,2,1,0,0,0,1]],"poison_vial":[[1,0,1,3,0,0,1,0,0,1,1,1,1]],"pressure_spike":[[1,0,1,3,0,0,1,0,0,1,0,1,1]],"pretty_mary_da_silva":[[3,1,1,1,1,0,0,2,1,0,0,0,1]],"read_write_share":[[3,1,1,3,0,0,1,2,1,0,0,0,1]],"rejig":[[1,0,4,10,1,0,3,0,0,4,1,1,0],[3,1,1,3,0,0,1,3,3,0,0,0,0]],"reprise":[[1,0,2,6,0,0,2,0,0,2,1,1,2]],"revolver":[[1,0,1,3,0,0,1,0,0,1,1,1,1]],"rigging_up":[[1,0,2,6,0,0,2,0,0,2,0,1,2]],"ritual":[[1,0,2,6,0,0,2,0,0,2,0,1,2]],"running_hot":[[1,0,1,3,0,0,1,0,0,1,0,1,1]],"s_dobrado":[[1,0,2,5,0,1,1,0,0,2,2,1,2]],"simulchip":[[1,0,1,3,0,0,1,0,0,1,0,1,1]],"sipa":[[1,0,1,3,0,0,1,0,0,1,0,1,1]],"slap_vandal":[[1,0,1,3,0,0,1,0,0,1,0,1,1]],"smartware_distributor":[[1,0,1,3,0,0,1,0,0,1,1,1,0]],"solidarity_badge":[[1,0,1,1,1,0,0,0,0,1,0,1,1]],"spark_of_inspiration":[[1,0,1,3,0,0,1,0,0,1,1,1,1]],"spec_work":[[1,0,1,3,0,0,1,0,0,1,0,1,1],[3,1,1,3,0,0,1,2,1,0,0,0,1]],"spree":[[1,0,1,3,0,0,1,0,0,1,0,1,1]],"steelskin_scarring":[[3,1,1,3,0,0,1,3,3,0,0,0,1]],"stoneship_chart_room":[[3,1,1,3,0,0,1,2,1,0,0,0,1]],"stowaway":[[1,0,1,3,0,0,1,0,0,1,1,1,1]],"sure_gamble":[[1,0,8,24,0,0,8,0,0,8,2,1,0],[3,1,3,9,0,0,3,8,7,0,0,0,0]],"t400_memory_diamond":[[1,0,2,6,0,0,2,0,0,2,1,1,0]],"take_a_dive":[[1,0,1,3,0,0,1,0,0,1,0,1,1]],"telework_contract":[[1,0,1,3,0,0,1,0,0,1,0,1,1],[3,1,1,3,0,0,1,2,1,0,0,0,1]],"the_artist":[[1,0,2,2,2,0,0,0,0,2,1,1,2],[3,1,1,1,1,0,0,2,1,0,0,0,1]],"the_back":[[1,0,1,3,0,0,1,0,0,1,1,1,1]],"the_tungsten_tailor":[[1,0,1,3,0,0,1,0,0,1,0,1,1]],"tranquilizer":[[1,0,1,3,0,0,1,0,0,1,1,1,1]],"transfer_of_wealth":[[1,0,2,6,0,0,2,0,0,2,2,1,2]],"tread_lightly":[[3,1,1,3,0,0,1,3,3,0,0,0,1]],"trickster_taka":[[1,0,2,4,1,0,1,0,0,2,0,1,2]],"umbrella":[[1,0,2,6,0,0,2,0,0,2,0,1,1],[3,1,1,1,1,0,0,2,1,0,0,0,1]],"underdome_irregulars":[[1,0,1,3,0,0,1,0,0,1,0,1,1],[3,1,1,3,0,0,1,3,3,0,0,0,1]],"unity":[[1,0,1,3,0,0,1,0,0,1,0,1,1]],"urban_art_vernissage":[[1,0,1,3,0,0,1,0,0,1,0,1,1],[3,1,1,3,0,0,1,2,1,0,0,0,1]],"utae":[[1,0,1,3,0,0,1,0,0,1,0,1,1]],"valentina_ferreira_carvalho":[[1,0,5,13,1,0,4,0,0,5,2,1,0]],"verbal_plasticity":[[1,0,2,2,2,0,0,0,0,2,1,1,0]],"vrcation":[[1,0,1,3,0,0,1,0,0,1,0,1,1]],"wake_implant_v2a_jrj":[[1,0,1,1,1,0,0,0,0,1,1,1,1],[3,1,1,1,1,0,0,3,3,0,0,0,1]],"whistleblower":[[1,0,4,6,3,0,1,0,0,4,2,1,0]],"word_on_the_street":[[1,0,1,1,1,0,0,0,0,1,1,1,0]],"zenit_chip_jz_2mj":[[1,0,1,2,0,1,0,0,0,1,1,1,1]]}}