{"schema":"mr.trends/1","version":"2026-09-27T040000Z","side":"corp","restriction":"standard_balance_update_26_08","tier_group":"megacity","months":["2026-06","2026-07","2026-08","2026-09"],"restrictions":["standard_ban_list_26_05","standard_balance_update_26_08"],"columns":["decks_with_card","copies_sum","qty1","qty2","qty3","games_total","games_won","entries_with_card_hc","cut_with_card_hc","tournaments_hc_with_card","decks_in_faction"],"baseline_columns":["side_decks","side_games","side_wins","side_entries_hc","side_cut_hc","tournaments","tournaments_hc","side_games_all","side_wins_all"],"baseline":[[3,1,4,17,10.5,4,4,1,1,17,10.5]],"factions":["anarch","criminal","haas_bioroid","jinteki","nbn","shaper","weyland_consortium"],"faction_baseline":[[3,1,2,1],[3,1,3,2],[3,1,4,1]],"cards":{"ablative_barrier":[[3,1,1,3,0,0,1,4,3,1,1,1,1]],"aggressive_trendsetting":[[3,1,1,3,0,0,1,4,3,1,1,1,1]],"architect_deployment_test":[[3,1,1,1,1,0,0,4,3,1,1,1,1]],"attini":[[3,1,1,3,0,0,1,3,1,1,1,1,1]],"b_1001":[[3,1,2,6,0,0,2,10,6.5,2,2,1,0]],"bass_ch1r180g4":[[3,1,1,1,1,0,0,4,3,1,1,1,1]],"bladderwort":[[3,1,1,3,0,0,1,3,1,1,1,1,1]],"blood_in_the_water":[[3,1,1,2,0,1,0,3,1,1,1,1,1]],"bring_them_home":[[3,1,1,3,0,0,1,3,1,1,1,1,1]],"charlotte_cacador":[[3,1,1,3,0,0,1,8,5.5,1,1,1,1]],"cohort_guidance_program":[[3,1,2,6,0,0,2,11,6.5,2,2,1,2]],"complete_image":[[3,1,1,3,0,0,1,8,5.5,1,1,1,1]],"congratulations":[[3,1,1,3,0,0,1,2,1,1,1,1,1]],"daily_quest":[[3,1,1,3,0,0,1,2,1,1,1,1,1]],"digital_rights_management":[[3,1,1,3,0,0,1,4,3,1,1,1,0]],"embedded_reporting":[[3,1,1,3,0,0,1,2,1,1,1,1,1]],"ezam":[[3,1,1,3,0,0,1,3,1,1,1,1,1]],"front_company":[[3,1,1,3,0,0,1,8,5.5,1,1,1,1]],"fujii_asset_retrieval":[[3,1,1,2,0,1,0,8,5.5,1,1,1,1]],"fully_operational":[[3,1,1,3,0,0,1,4,3,1,1,1,1]],"hagen":[[3,1,1,1,1,0,0,4,3,1,1,1,1]],"hedge_fund":[[3,1,4,12,0,0,4,17,10.5,4,4,1,0]],"hyoubu_precog_manifold":[[3,1,1,3,0,0,1,3,1,1,1,1,1]],"increased_drop_rates":[[3,1,1,3,0,0,1,2,1,1,1,1,1]],"ivik":[[3,1,1,3,0,0,1,8,5.5,1,1,1,1]],"karuna":[[3,1,1,1,1,0,0,8,5.5,1,1,1,1]],"knowledge_seeker":[[3,1,1,3,0,0,1,8,5.5,1,1,1,1]],"let_them_dream":[[3,1,1,3,0,0,1,2,1,1,1,1,0]],"lethe":[[3,1,1,3,0,0,1,2,1,1,1,1,1]],"lightning_laboratory":[[3,1,1,3,0,0,1,4,3,1,1,1,1]],"longevity_serum":[[3,1,1,1,1,0,0,3,1,1,1,1,1]],"lotus_haze":[[3,1,1,3,0,0,1,3,1,1,1,1,1]],"m_i_c":[[3,1,1,3,0,0,1,4,3,1,1,1,1]],"megaprix_qualifier":[[3,1,1,3,0,0,1,4,3,1,1,1,1]],"mercia_b4ll4rd":[[3,1,1,3,0,0,1,4,3,1,1,1,1]],"mestnichestvo":[[3,1,1,3,0,0,1,2,1,1,1,1,1]],"napd_cordon":[[3,1,2,6,0,0,2,6,4,2,2,1,0]],"orbital_superiority":[[3,1,1,3,0,0,1,4,3,1,1,1,0]],"otto_campaign":[[3,1,1,3,0,0,1,4,3,1,1,1,1]],"ping":[[3,1,1,2,0,1,0,2,1,1,1,1,1]],"piranhas":[[3,1,1,3,0,0,1,2,1,1,1,1,1]],"proprionegation":[[3,1,1,3,0,0,1,8,5.5,1,1,1,1]],"reaper_function":[[3,1,1,3,0,0,1,3,1,1,1,1,1]],"regolith_mining_license":[[3,1,2,6,0,0,2,11,6.5,2,2,1,0]],"rime":[[3,1,1,3,0,0,1,3,1,1,1,1,0]],"sisyphus_protocol":[[3,1,1,3,0,0,1,3,1,1,1,1,1]],"sprint":[[3,1,1,3,0,0,1,4,3,1,1,1,1]],"stoke_the_embers":[[3,1,1,3,0,0,1,2,1,1,1,1,1]],"superconducting_hub":[[3,1,1,3,0,0,1,3,1,1,1,1,0]],"sync_rerouting":[[3,1,1,3,0,0,1,2,1,1,1,1,1]],"tatu_bola":[[3,1,1,3,0,0,1,3,1,1,1,1,1]],"the_powers_that_be":[[3,1,1,3,0,0,1,8,5.5,1,1,1,0]],"tithe":[[3,1,2,6,0,0,2,12,8.5,2,2,1,0]],"tomorrows_headline":[[3,1,1,1,1,0,0,2,1,1,1,1,1]],"vampyronassa":[[3,1,1,3,0,0,1,8,5.5,1,1,1,1]],"vulnerability_audit":[[3,1,1,3,0,0,1,8,5.5,1,1,1,0]],"whitespace":[[3,1,1,3,0,0,1,2,1,1,1,1,0]]}}