{"schema":"mr.trends/1","version":"2026-09-27T040000Z","side":"corp","restriction":"all","tier_group":"megacity","months":["2026-06","2026-07","2026-08","2026-09"],"restrictions":["standard_ban_list_26_05","standard_balance_update_26_08"],"columns":["decks_with_card","copies_sum","qty1","qty2","qty3","games_total","games_won","entries_with_card_hc","cut_with_card_hc","tournaments_hc_with_card","decks_in_faction"],"baseline_columns":["side_decks","side_games","side_wins","side_entries_hc","side_cut_hc","tournaments","tournaments_hc","side_games_all","side_wins_all"],"baseline":[[0,0,6,0,0,6,6,1,1,0,0],[3,1,4,17,10.5,4,4,1,1,17,10.5]],"factions":["anarch","criminal","haas_bioroid","jinteki","nbn","shaper","weyland_consortium"],"faction_baseline":[[0,0,2,2],[0,0,3,1],[0,0,4,1],[0,0,6,2],[3,1,2,1],[3,1,3,2],[3,1,4,1]],"cards":{"ablative_barrier":[[3,1,1,3,0,0,1,4,3,1,1,1,1]],"aggressive_trendsetting":[[0,0,1,3,0,0,1,0,0,1,1,1,1],[3,1,1,3,0,0,1,4,3,1,1,1,1]],"anemone":[[0,0,1,3,0,0,1,0,0,1,1,1,1]],"ansel_2_0":[[0,0,1,3,0,0,1,0,0,1,1,1,1]],"anthill_excavation_contract":[[0,0,1,3,0,0,1,0,0,1,1,1,1]],"anvil":[[0,0,1,3,0,0,1,0,0,1,1,1,1]],"architect_deployment_test":[[3,1,1,1,1,0,0,4,3,1,1,1,1]],"argus_crackdown":[[0,0,1,3,0,0,1,0,0,1,1,1,1]],"attini":[[3,1,1,3,0,0,1,3,1,1,1,1,1]],"b_1001":[[0,0,1,3,0,0,1,0,0,1,1,1,0],[3,1,2,6,0,0,2,10,6.5,2,2,1,0]],"ballista":[[0,0,1,3,0,0,1,0,0,1,1,1,1]],"bass_ch1r180g4":[[3,1,1,1,1,0,0,4,3,1,1,1,1]],"bladderwort":[[3,1,1,3,0,0,1,3,1,1,1,1,1]],"blood_in_the_water":[[3,1,1,2,0,1,0,3,1,1,1,1,1]],"bloop":[[0,0,1,3,0,0,1,0,0,1,1,1,1]],"bring_them_home":[[3,1,1,3,0,0,1,3,1,1,1,1,1]],"caveat_emptor":[[0,0,1,3,0,0,1,0,0,1,1,1,1]],"charlotte_cacador":[[3,1,1,3,0,0,1,8,5.5,1,1,1,1]],"cohort_guidance_program":[[0,0,1,3,0,0,1,0,0,1,1,1,1],[3,1,2,6,0,0,2,11,6.5,2,2,1,2]],"complete_image":[[3,1,1,3,0,0,1,8,5.5,1,1,1,1]],"congratulations":[[0,0,1,3,0,0,1,0,0,1,1,1,1],[3,1,1,3,0,0,1,2,1,1,1,1,1]],"corporate_hospitality":[[0,0,1,3,0,0,1,0,0,1,1,1,0]],"daily_quest":[[0,0,1,3,0,0,1,0,0,1,1,1,1],[3,1,1,3,0,0,1,2,1,1,1,1,1]],"digital_rights_management":[[3,1,1,3,0,0,1,4,3,1,1,1,0]],"djupstad_grid":[[0,0,1,3,0,0,1,0,0,1,1,1,1]],"echo":[[0,0,1,1,1,0,0,0,0,1,1,1,1]],"elivagar_bifurcation":[[0,0,1,3,0,0,1,0,0,1,1,1,1]],"embedded_reporting":[[0,0,1,3,0,0,1,0,0,1,1,1,1],[3,1,1,3,0,0,1,2,1,1,1,1,1]],"empiricist":[[0,0,1,1,1,0,0,0,0,1,1,1,1]],"ezam":[[3,1,1,3,0,0,1,3,1,1,1,1,1]],"flower_sermon":[[0,0,1,3,0,0,1,0,0,1,1,1,1]],"front_company":[[3,1,1,3,0,0,1,8,5.5,1,1,1,1]],"fujii_asset_retrieval":[[3,1,1,2,0,1,0,8,5.5,1,1,1,1]],"fully_operational":[[0,0,1,3,0,0,1,0,0,1,1,1,1],[3,1,1,3,0,0,1,4,3,1,1,1,1]],"hagen":[[3,1,1,1,1,0,0,4,3,1,1,1,1]],"hammer":[[0,0,1,3,0,0,1,0,0,1,1,1,1]],"hansei_review":[[0,0,1,3,0,0,1,0,0,1,1,1,1]],"hedge_fund":[[0,0,6,18,0,0,6,0,0,6,6,1,0],[3,1,4,12,0,0,4,17,10.5,4,4,1,0]],"hostile_architecture":[[0,0,1,2,0,1,0,0,0,1,1,1,1]],"humanoid_resources":[[0,0,1,3,0,0,1,0,0,1,1,1,1]],"hyoubu_precog_manifold":[[3,1,1,3,0,0,1,3,1,1,1,1,1]],"increased_drop_rates":[[0,0,1,3,0,0,1,0,0,1,1,1,1],[3,1,1,3,0,0,1,2,1,1,1,1,1]],"ivik":[[3,1,1,3,0,0,1,8,5.5,1,1,1,1]],"karuna":[[3,1,1,1,1,0,0,8,5.5,1,1,1,1]],"kessleroid":[[0,0,1,3,0,0,1,0,0,1,1,1,1]],"key_performance_indicators":[[0,0,1,3,0,0,1,0,0,1,1,1,1]],"knowledge_seeker":[[3,1,1,3,0,0,1,8,5.5,1,1,1,1]],"la_costa_grid":[[0,0,1,3,0,0,1,0,0,1,1,1,1]],"let_them_dream":[[0,0,4,10,0,2,2,0,0,4,4,1,0],[3,1,1,3,0,0,1,2,1,1,1,1,0]],"lethe":[[0,0,1,3,0,0,1,0,0,1,1,1,1],[3,1,1,3,0,0,1,2,1,1,1,1,1]],"lightning_laboratory":[[3,1,1,3,0,0,1,4,3,1,1,1,1]],"longevity_serum":[[0,0,1,1,1,0,0,0,0,1,1,1,1],[3,1,1,1,1,0,0,3,1,1,1,1,1]],"lotus_haze":[[3,1,1,3,0,0,1,3,1,1,1,1,1]],"m_i_c":[[3,1,1,3,0,0,1,4,3,1,1,1,1]],"mahkota_langit_grid":[[0,0,1,3,0,0,1,0,0,1,1,1,0]],"maskirovka":[[0,0,1,3,0,0,1,0,0,1,1,1,1]],"megaprix_qualifier":[[3,1,1,3,0,0,1,4,3,1,1,1,1]],"mercia_b4ll4rd":[[3,1,1,3,0,0,1,4,3,1,1,1,1]],"mestnichestvo":[[0,0,1,3,0,0,1,0,0,1,1,1,1],[3,1,1,3,0,0,1,2,1,1,1,1,1]],"myoshu":[[0,0,1,3,0,0,1,0,0,1,1,1,1]],"napd_cordon":[[0,0,2,6,0,0,2,0,0,2,2,1,0],[3,1,2,6,0,0,2,6,4,2,2,1,0]],"neurospike":[[0,0,1,3,0,0,1,0,0,1,1,1,1]],"off_the_books":[[0,0,1,3,0,0,1,0,0,1,1,1,1]],"orbital_superiority":[[0,0,1,3,0,0,1,0,0,1,1,1,0],[3,1,1,3,0,0,1,4,3,1,1,1,0]],"otto_campaign":[[3,1,1,3,0,0,1,4,3,1,1,1,1]],"palisade":[[0,0,2,6,0,0,2,0,0,2,2,1,0]],"peer_review":[[0,0,1,3,0,0,1,0,0,1,1,1,1]],"ping":[[0,0,1,2,0,1,0,0,0,1,1,1,1],[3,1,1,2,0,1,0,2,1,1,1,1,1]],"piranhas":[[0,0,1,3,0,0,1,0,0,1,1,1,1],[3,1,1,3,0,0,1,2,1,1,1,1,1]],"project_ingatan":[[0,0,2,6,0,0,2,0,0,2,2,1,2]],"proprionegation":[[3,1,1,3,0,0,1,8,5.5,1,1,1,1]],"realloc":[[0,0,1,3,0,0,1,0,0,1,1,1,1]],"reaper_function":[[3,1,1,3,0,0,1,3,1,1,1,1,1]],"red_level_clearance":[[0,0,1,3,0,0,1,0,0,1,1,1,1]],"regolith_mining_license":[[0,0,3,9,0,0,3,0,0,3,3,1,0],[3,1,2,6,0,0,2,11,6.5,2,2,1,0]],"reverb":[[0,0,1,3,0,0,1,0,0,1,1,1,1]],"rime":[[0,0,2,6,0,0,2,0,0,2,2,1,0],[3,1,1,3,0,0,1,3,1,1,1,1,0]],"sacrifice_zone_expansion":[[0,0,1,3,0,0,1,0,0,1,1,1,1]],"scapenet":[[0,0,1,3,0,0,1,0,0,1,1,1,1]],"seamless_launch":[[0,0,1,3,0,0,1,0,0,1,1,1,1]],"send_a_message":[[0,0,2,6,0,0,2,0,0,2,2,1,0]],"sericulture_expansion":[[0,0,1,3,0,0,1,0,0,1,1,1,1]],"simulation_reset":[[0,0,1,3,0,0,1,0,0,1,1,1,1]],"sisyphus_protocol":[[3,1,1,3,0,0,1,3,1,1,1,1,1]],"sorocaban_blade":[[0,0,1,3,0,0,1,0,0,1,1,1,1]],"sprint":[[3,1,1,3,0,0,1,4,3,1,1,1,1]],"stavka":[[0,0,1,3,0,0,1,0,0,1,1,1,1]],"stegodon_mk_iv":[[0,0,1,3,0,0,1,0,0,1,1,1,1]],"stoke_the_embers":[[0,0,1,3,0,0,1,0,0,1,1,1,1],[3,1,1,3,0,0,1,2,1,1,1,1,1]],"superconducting_hub":[[0,0,1,3,0,0,1,0,0,1,1,1,0],[3,1,1,3,0,0,1,3,1,1,1,1,0]],"sync_rerouting":[[0,0,1,3,0,0,1,0,0,1,1,1,1],[3,1,1,3,0,0,1,2,1,1,1,1,1]],"tatu_bola":[[3,1,1,3,0,0,1,3,1,1,1,1,1]],"the_basalt_spire":[[0,0,1,2,0,1,0,0,0,1,1,1,1]],"the_powers_that_be":[[0,0,1,1,1,0,0,0,0,1,1,1,0],[3,1,1,3,0,0,1,8,5.5,1,1,1,0]],"the_red_room":[[0,0,1,3,0,0,1,0,0,1,1,1,1]],"tithe":[[0,0,1,3,0,0,1,0,0,1,1,1,0],[3,1,2,6,0,0,2,12,8.5,2,2,1,0]],"tomorrows_headline":[[0,0,1,1,1,0,0,0,0,1,1,1,1],[3,1,1,1,1,0,0,2,1,1,1,1,1]],"tree_line":[[0,0,1,3,0,0,1,0,0,1,1,1,1]],"unleash":[[0,0,1,3,0,0,1,0,0,1,1,1,1]],"vampyronassa":[[3,1,1,3,0,0,1,8,5.5,1,1,1,1]],"vovo_ozetti":[[0,0,1,3,0,0,1,0,0,1,1,1,1]],"vulnerability_audit":[[3,1,1,3,0,0,1,8,5.5,1,1,1,0]],"vulture_fund":[[0,0,1,3,0,0,1,0,0,1,1,1,1]],"whitespace":[[3,1,1,3,0,0,1,2,1,1,1,1,0]],"yakov_erikovich_avdakov":[[0,0,1,1,1,0,0,0,0,1,1,1,1]],"zato_city_grid":[[0,0,1,3,0,0,1,0,0,1,1,1,1]]}}